,title,content,write_date,url,writer,category
81,(이름) 위기론에 초선 반박 'imf때완 다르다',". '내가 1997년 상황을 얘기하는 (이름) 있다. 당시 1월에 한보철강이 부도났는데 아무도 10개월 후에 나라 전체 경제위기로 구제금융까지 받게 될지 몰랐다.'((이름) 새누리당 의원). . 'imf(구제금융) 당시와 지금은 일부는 같지만 일부는 다르다. 당시 결정적인 건 금융부채 등 지불능력 부족의 문제였는데, 지금은 지불능력의 문제는 없다.'((이름) 의원). . 국정감사장에서 여당 내 경제전문가들의 단기전망이 엇갈렸다. 여당 내 거물 경제통인 (이름) 의원(4선)의 단기 위기론을 초선의 경제관료 출신 (이름) 의원이 반박했다. . . 추 의원은 14일 기획재정위원회 국정감사에서 '경제가 실제로 어렵고 imf사태와 비교도 하고 걱정도 하는데 그땐 기업의 부실과 금융부채 문제 등 지불이 어려워지는 문제가 있었다'며 '하지만 지금은 지불능력에 당장 문제가 없는 만큼 단기적으로 위기가 오고 시스템 리스크가 올 가능성은 낮다'고 말했다. . . 이는 앞서 유 의원이 '대우조선해양 사태는 한보철강 부도보다 더 위중한 상황을 불러올 수 있다'며 주장한 위기론을 반박한 내용이다. 유 의원은 이날 '경제성장률이 2.7~2.8이나 되면 다행'이라며 '지난 시기 수십년을 돌아봐도 찾아볼 수 없었던 안보와 경제의 위기가 동시에 발생하는 상황이 오고 있는 것 같다'고 우려했다. . . 유 의원은 국감 기간 내 단기 위기론을 강조했다. 앞선 국감에서는 '(이름) 정부 임기 말에 imf구제금융 당시에 준하는 경제위기가 올 수 있다'고 직접적으로 경고한 바 있다. . . 단기 위기론에 대해서는 의견이 갈렸지만 중장기 경제 리스크에 대해서는 전망이 일치했다. 다만 진단이 다른 만큼 해법은 달랐다. 추 의원은 '문제는 구조적인 체력 약화'라며 '성장잠재력의 확충과 개혁 등에 대한 노력이 필요하며 이 가운데 치유하기 어려운 우리 사회의 이해 갈등 요소를 해소하기 위한 노력도 기울여야 한다'고 말했다. . . 반면 유 의원은 정부 차원의 특단의 대책을 주문했다. 그는 '대통령이 지금부터 비상한 위기의식을 갖고 필요하다면 확장적 재정정책이든 뭐든 (대책을 내고) 국회는 이를 뒷받침해야 한다고 생각한다'며 '부총리 겸 기재부 장관이 대통령과 그 얘기를 할 필요가 있다고 본다'고 말했다.. . .",2016-10-14 18:48:54,https://news.mt.co.kr/mtview.php?no=2016101418297667354,머니투데이뉴스,정치
82,[오늘 날씨] 전국 눈·비에 기온도 '뚝'…'추위 조심하세요',"(서울=뉴스1) (이름) 기자 = . . . 월요일인 1일은 전국적으로 비나 눈이 내리는 가운데 기온이 큰 폭으로 떨어져 매우 춥겠다. 특히 충남 (이름)과 전라남북도에는 2일까지 눈이 쌓일 정도로 내릴 전망이다. 기상청은 이날 북쪽을 지나는 기압골의 영향에서 벗어나 북서쪽에서 확장하는 찬 대륙고기압의 영향을 받아 전국이 대체로 흐리고 새벽 한때 비(강수확률 60%, 서울·경기 북부 지역과 강원 영서 북부·산간 지역은 눈 또는 비)가 오다가 그칠 것으로 예보했다. 또 서울·경기도와 강원도(강원 동해안 제외)에는 아침부터 낮 사이, 충청남북도와 전라남북도는 낮부터 눈(강수확률 60~80%)이 올 것으로 내다봤다. 경남 북서 내륙 지역에도 낮 한때 눈(강수확률 60%)이 오는 곳이 있겠다. 적설량은 충남 (이름)·전라남북도(전남 남해안 제외)·제주도 산간·울릉도·독도 등지에서 3~10㎝, 충청남북도(충남 (이름) 제외)·전남 남해안·강원도 북부 산간·서해5도 등지에서 1~3㎝, 서울·경기도·강원도 영서·제주도·경남 북서 내륙 등지에서 1㎝ 미만으로 예상된다. 기상청은 '찬 공기가 남하하면서 아침부터는 기온이 크게 떨어져 춥겠고 바람도 강하게 불어 체감온도는 더욱 낮겠다'며 건강 관리와 시설물 관리에 대한 유의를 당부했다. 또 '낮부터 눈이 내리면서 충남 (이름)과 전라남북도에는 2일까지 다소 많은 눈이 쌓이는 곳이 있겠다'며 '오후부터 기온이 떨어져 내린 눈이 얼어 도로가 미끄러운 곳이 있겠으니 교통 안전과 시설물 관리에 각별히 유의하길 바란다'고 덧붙였다. 이어 '새벽에 (이름)을 시작으로 해안에는 바람이 매우 강하게 불겠고 오전부터는 내륙에도 바람이 강하게 불 것' 이라며 시설물 관리에 대한 유의 역시 당부했다. 아침 최저기온은 1도에서 9도, 낮 최고기온은 1도에서 10도로 오늘보다 낮겠다. 미세먼지(pm10) 농도는 전 권역이 '좋음'(일평균 0~30㎍/㎥) 수준으로 나타나겠다. 바다의 물결은 남해앞바다와 동해앞바다에서 1.0~3.0m로 높게 일겠고 그 밖의 해상에서는 2.0~5.0m로 매우 높게 일겠다. . <저작권자 © 뉴스1코리아, 무단전재 및 재배포 금지>",2014-12-01 05:50:00,https://www.news1.kr/articles/?1978891,뉴스1,사건사고
83,"3번 (이름)-4번 러프, 6안타 3타점 합작.. 중심 폭발=승리",". . 삼성 라이온즈가 넥센 히어로즈를 제압하며 전날 패배를 설욕했다. 전날의 경우 타선이 답답했다. 하지만 이날은 달랐다. 특히 3번 (이름)-4번 다린 러프가 나란히 좋은 모습을 보였다. 중심타선이 해주면서 팀도 이길 수 있었다.. . 삼성은 21일 고척 스카이돔에서 열린 '2018 신한은행 my car kbo 리그' 정규시즌 넥센전에서 선발 백정현의 호투와 폭발한 타선의 힘을 더해 10-3의 승리를 따냈다.. . 전날 0-2에서 1-2로, 1-3에서 2-3으로 추격전을 펼친 끝에 아쉽게 패했던 삼성이다. 19일 kia를 상대로 끝내기 승리를 거둔 기세를 이어가지 못했다. 하지만 이날 완승을 거두며 다시 분위기를 바꿨다. 투타 모두 넥센에 우위를 보였다.. . 일단 선발 백(이름) 호투했다. 백(이름) 7이닝 7피안타(1피홈런) 11탈삼진 3실점의 퀄리티스타트 플러스 피칭을 선보이며 승리투수가 됐다. 시즌 7승(7패)째다. 특유의 제구가 빛을 발했다. 이를 바탕으로 개인 한 경기 (이름) 11탈삼진을 뽑아냈다. 기존 기록인 8탈삼진을 훌쩍 넘어섰다.. . 그리고 타선이 터졌다. 이날 삼성은 장단 15안타를 폭발시켰고, 사사구도 6개를 얻어내며 10득점에 성공했다. 지난 8월 14일 넥센전(당시 10-11 패) 이후 38일 만에 두 자릿수 득점을 만들어냈다. 시원하게 터진 셈이다.. . 중심타선이 좋은 모습을 보인 것이 반가웠다. 이날 삼성은 3번 (이름)-4번 다린 러프-5번 (이름)을 배치했다. 전날은 3번 (이름)-4번 다린 러프-5번 (이름)였지만, 이날은 (이름)과 (이름)가 휴식 차원에서 빠졌고, (이름)-(이름)이 들어갔다.. . 결과는 성공이었다. 특히 3번 (이름)이 3안타 2타점 1득점을 터뜨렸고, 4번 러프는 솔로포를 포함해 3안타 1타점 1득점 1볼넷을 만들어냈다. 이 둘이서만 6안타 3타점 합작이다. 5번 (이름) 역시 1안타 1타점을 더했다.. . 영양가도 높았다. 러프는 3-3으로 맞선 5회초 솔로 홈런을 폭발시키며 결승타의 주인공이 됐다. 지난 8월 14일 넥센전 이후 38일 만에 시즌 26호 홈런을 때려냈다. 긴 침묵을 깬 것이다.. . (이름)은 6회초 2타점 적시타를 때려내 6-3을 만들었다. 사실상 여기서 승부가 갈렸다. 이후 삼성은 7회초 (이름)의 2타점 적시타, (이름)의 2타점 적시 2루타가 나와 쐐기를 박았다.. . 전날 경기에서 삼성은 (이름)이 5타수 무안타, 러프가 2타수 무안타 3볼넷, (이름)가 5타수 2안타를 쳤다. 합계 12타수 2안타 3볼넷. 타점도, 득점도 없었다. 1번 (이름)이 솔로 홈런 포함 2안타 1타점, (이름)이 솔로포 포함 3안타 1타점을 만들며 밥상을 차렸으나, 이를 받아먹진 못한 모양새가 됐다.. . 이날은 아니었다. 1번 (이름)이 2안타 2타점, 2번 (이름)가 2안타 2타점 1득점으로 좋았다. 테이블 세터의 구성은 바뀌어도 밥상은 잘 차린 셈이다. 그리고 3번으로 (이름) (이름)와 4번 러프가 이를 잘 살린 경기가 됐다.. . 중심타선에는 팀에서 가장 잘 치는 타자들이 들어간다고 해도 과언이 아니다. 중심타선의 활약 여부에 따라 승부가 갈리는 경우가 많다. 20~21일 삼성이 이를 보여줬다. 중심타선이 주춤하니 팀이 패했고, 살아나니 팀이 이겼다. 삼성으로서는 승리만큼이나 반가운 부분이다.. .",2018-09-21 22:20:16,https://star.mt.co.kr/stview.php?no=2018092114391759703,스타뉴스,스포츠
84,'스타벅스 콜림비아 로스트'는 100% 콜롬비아산이 아니다?,"‘식탁 위의 세상’은 세상 온갖 음식의 ‘출처’에 질문을 던진다. 발단은 원산지 표시제였고, 기폭제는 바로 ‘스타벅스’다.. . 저자는 아침마다 마시는 ‘스타벅스 콜롬비아 로스트’를 누가 재배하는지 알고 싶어 스타벅스에 문의했다. ‘독점 정보’라 알려줄 수 없다는 답장을 받는다. 저자는 직접 커피를 만드는 사람들을 찾아가는 흔치 않은 여정에 나선다.. . 저자가 만난 콜롬비아 스타벅스 현지 협력업체에 따르면 ‘스타벅스 콜롬비아 로스트’는 100% 콜롬비아산이 아니다. 콜롬비아에서는 단맛이 나는 아라비카만 재배된다. 쓴맛이 나는 로부스타 커피를 다른 나라에서 수입해 ‘기호에 맞게’ 혼합하고 있다는 얘기다.. . “‘스타벅스 콜롬비아 로스트’를 위해 해발 2km의 고산지대, 언제라도 폭발할 것 같은 화산지대에서 소중한 붉은 열매를 완벽한 커피로 키우고 있다”는 회사 측의 홍보는 맥빠진다. 또, “‘블랙 에이프런 익스클루시브’라는 고급스러운 이름과 높은 가격을 붙인 원두를 ‘깨끗한 물’, ‘철저한 환경 보존 농법으로 재배’한다”는 말도 강에서 말 사체 썩는 듯한 악취가 가는 에티오피아의 생산 농장을 눈으로 본 저자 입장에선 헛웃음 나올 수밖에 없다. 폭로가 있기 전까지 스타벅스 관계자가 이 농장을 방문한 적은 단 한 번도 없었다고 저자는 밝혔다.. . 뉴욕타임스(nyt) 베스트셀러 저자는 즐겨 입는 옷의 원산지를 추적해 온두라스와 방글라데시, 캄보디아와 중국의 피복 노동자들을 만났던 경험을 담아 ‘나는 어디에서 입는가?’를 썼다. 세계화된 옷장에 대한 탐사 르포를 쓴 저널리스트의 예리한 눈초리가 ‘음식의 세계화’에서도 빛났다.. . 저자는 농약과 플랜테이션 농장, 저장과 유통 혁신 덕분에 싼값에 음식을 먹게 된 대신 음식의 출처에 둔감해지고 있다고 말한다. 저자는 세상과 음식을 위한 ‘정직한 식탁’의 대안도 제시한다.. . 저자는 우리가 농약과 플랜테이션 농장, 저장과 유통 혁신 덕분에 다양한 먹거리들을 싼값에 먹게 된 대신 음식의 출처에 둔감해지고 있다고 봤다. 음식이라는 렌즈로 세상을 보는 저자는 음식의 세계화 이면에 숨겨진 진실을 파헤치는 것과 함께 세상과 음식을 위한 ‘정직한 식탁’의 대안도 제시한다. . . ◇식탁 위의 세상=켈시 티어먼 지음. 부키 펴냄. 392쪽/1만6500원..",2016-01-30 03:10:53,https://news.mt.co.kr/mtview.php?no=2016012722532176853,머니투데이뉴스,문화
85,'기생충' 수상하나..美 골든글로브 外 [넥스트위클리],". 다음 주 영화계 소식 알려드립니다.. . ○...6일 오전 10시(한국시각)부터 미국 로스앤젤레스에서 제77회 골든글로브 시상식이 열린다. 골든글로브 시상식은 할리우드 외신기자협회가 주관하는 시상식으로 매년 영화, 드라마 부문 최고의 작품과 배우를 선정한다. 아카데미상과 더불어 미국 양대 영화상으로 손꼽히며, 아카데미 수상 결과를 예상할 수 있는 전초전이다. 제77회 골든글로브에서는 봉준호 감독의 '기생충'이 감독상, 각본상, 외국어영화상 후보로 올라 수상 여부에 관심이 쏠린다. . . . ○...영화 '정직한 후보'(감독 (이름))가 첫 공개된다. 6일 오전 11시 서울 강남구 cgv압구정에서 '정직한 후보' 제작보고회가 개최된다. '정직한 후보'는 거짓말이 제일 쉬운 3선 국회의원 주상숙(라미란 분)이 선거를 앞둔 어느날 하루 아침에 거짓말을 못하게 되면서 벌어지는 좌충우돌 코미디다. 이 자리에는 라미란, (이름), 나문희, (이름), (이름) 그리고 (이름) 감독이 참석해 영화에 대한 다양한 이야기를 전할 예정이다.. . . ○...영화 '닥터 두리틀'이 북미보다 한국에서 먼저 베일을 벗는다. 7일 오후 4시 30분 서울 광진구 롯데시네마 건대입구에서 영화 '닥터 투리틀' 언론배급시사회가 진행된다. '닥터 두리틀'은 동물과 대화할 수 있는 마법 같은 특별한 능력을 가진 두리틀(로버트 다우니 주니어)이 왕국을 구하기 위해 동물들과 함께 놀라운 모험을 떠나는 2020년 첫 번째 판타지 어드벤처다. . . . ○...8일 오후 7시 30분 경희대학교 평화의 전당에서 영화 '해지치않아'(감독 손재곤) 시네마 콘서트가 열린다. 영화 '해치지않아'는 망하기 일보 직전의 동물원 동산파크에 야심차게 원장으로 부임하게 된 변호사 태수((이름) 분)와 팔려간 동물 대신 동물로 근무하게 된 직원들의 기상천외한 미션을 그린 이야기다. '해치지않아' 시네마 콘서트는 개그우먼 (이름)의 사회로 진행되며 (이름), (이름), (이름), (이름), (이름) 그리고 손재곤 감독이 참석한다.",2020-01-05 09:00:00,https://star.mt.co.kr/stview.php?no=2020010314345717829,스타뉴스,연예
86,"'노트북, 데탑 이어 65형 tv까지'…쏟아지는 게이밍 제품들","세계 최대 규모 가전제품전시회 ces 2019에서 다양한 게이밍 제품이 쏟아지고 있다.. . 8일(현지시간)부터 미국 라스베이거스에서 열리는 ces 2019에 맞춰 제품 제조사는 최신 게임용 노트북을 비롯해 데스크톱, 게임용 모니터 등 다양한 관련 제품을 발표했다. . . 이번 제품은 최신 프로세서와 그래픽 카드가 탑재돼 게임밍 제품을 기다리는 소비자에게 만족스런 제품이 될 것으로 기대된다.. . ◇제품은 작게…성능은 든든하게=델의 게임 전문 고성능 컴퓨터 브랜드 에일리언웨어는 새로운 17인치 게이밍노트북 '에일리언웨어 m17'을 발표했다.. . 이 제품은 에일리언웨어에서 그동안 만든 제품 중 가장 얇고 가벼운 17인치 게이밍 노트북이다. 얇아진 만큼 문제가 될 수 있는 발열은 델의 'cyro-tech v2.0' 냉각 기술을 적용해 (이름) 했다.. . 제품은 화면 주사율에 따라 디스플레이 패널이 달라진다. ips 패널은 60hz, tn 패널은 120hz까지 지원한다. 인텔 코어 i9 프로세서와 32gb(기가바이트) 램을 선택할 수 있다. 게임 성능에 영향을 미치는 그래픽 카드는 지포스 gtx 1050ti/rtx2060/2070 맥스-q/2080 맥스-q 등이 탑재돼 출시된다. 제품 두께는 23mm이며, 무게는 2.62kg이다.. . 삼성전자도 게이밍 노트북 '오디세이'의 신형을 발표했다. 제품은 지포스 rtx2080 그래픽카드가 탑재된다. 발열을 (이름) 하기 위해 2개의 새로 디자인한 냉각 팬과 5개의 히트파이프가 들어갔다. 화면 찢김 현상을 막아주는 지싱크(g-sync)를 지원하며, 주사율 144hz를 갖춘 15.6인치 풀hd 디스플레이가 적용됐다. 두께는 19.9mm이며 무게는 2.4kg.. . hp는 세계 최초로 240hz의 디스플레이를 탑재한 게이밍 노트북 'omen 15' 신형을 선보였다. 이 제품은 15.6인치 풀hd 디스플레이를 탑재한 제품으로, 기본 사양은 60hz의 ips 패널이지만, 사용자 선택으로 240hz의 tn 패널을 선택할 수 있다.. . 다양한 게이밍 액세서리를 만드는 커세어는 노트북이 아닌 데스크톱을 선보였다. 이 제품은 커세어의 수랭식 냉각 시스템을 기본 내장하고 있는 점이 특징이다. 제품은 크기 별로 3가지로 출시된다. 크기에 따라 사양도 달라지며, 최대 인텔 코어 i9와 32gb 램, 지포스 rtx2080ti 등이 탑재돼 최고의 성능을 제공한다.. . . . ◇고 주사율·hdr 필수…달라지는 모니터=hp는 게임 전용 tv omen x emperium 65를 발표했다. 이 제품은 uhd(3840x2160) 해상도를 가진 64.5인치 크기의 tv다. 주사율 144hz을 갖췄으며, 1000니트 밝기로 hdr(하(이름)내믹레인지)를 지원한다. 또한 사운바가 내장돼 있어 별도의 스피커가 필요없다. 제품은 2월에 출시되면 판매 가격은 4999달러(약 562만원)다.. . . . 게이밍 기어 업체 레이저는 자사의 첫 번째 게이밍모니터 랩터(raptor)를 홈페이지에 공개했다. 이 제품은 27인치 qhd(2560x1440) 해상도에 144hz 주사율을 갖춘 ips 패널을 탑재했으며, vesa 규격의 hdr400을 만족한다. . . 제조사에 따르면 해당 모니터에 탑재된 ips 패널은 dci-p3 색역 95%을 지원한다. 디스플레이 표면은 빛 반사가 없는 논글레어 방식이며, 3면 제로 베젤과 레이저 크로마 rgb 조명 효과가 적용된 모니터 스탠드가 특징이다. . . 디스플레이 후면에는 hdmi 2.0, 디스플레이 포트 1.4, usb 3.1 gen1, usb-c 등 다양한 단자를 갖췄으며, 스탠드에 각종 연결 케이블을 정리할 수 있도록 디자인됐다. 출시 일정은 공개하지 않았지만, 가격은 700달러(약 78만원)로 확정됐다.. . .",2019-01-09 08:29:50,https://news.mt.co.kr/mtview.php?no=2019010814172537147,머니투데이뉴스,IT_과학
87,"[전문] 잔나비 측, sbs 보도로 (이름) 피해 주장 '전혀 관련 없다'","(서울=뉴스1) (이름) 기자 = 밴드 잔나비 측이 리더이자 보컬인 (이름)과 관련한 의혹에 대해 해명했다. 잔나비 측은 25일 오전 공식 sns를 통해 '어제 한 방송사의 뉴스로 인해 피해를 입고 있다'며 '뉴스로 보도된 해당 내용은 일절 사실이 아니며 저희 페포니뮤직과는 전혀 관련이 없다'고 강조했다. 이어 '보도에 거론된 두 아들 또한 아버지의 사업과는 전혀 관련이 없으며 관련 조사를 받은 적도 없다'며 '현재 확인되지 않은 허위사실들이 무분별하게 커뮤니티 게시판 등에 유포되고 있어 이에 있어 법적 강력조치를 취할 예정이다. 앞으로 근거 없는 허위사실 유포를 자제해주시길 부탁드리겠다'고 당부했다. 한편 지난 24일 방송된 sbs '뉴스8'에서는 (이름) 전 법무부 차관에게 3000만원이 넘는 향응과 접대를 한 혐의로 사업가 최모씨가 검찰 조사를 받았다는 내용이 보도됐다. 또한 유명 밴드의 보컬인 아들이 경영에도 개입했다는 의혹을 전했다. 이후 네티즌들은 사업가 최씨, 유명 밴드 등의 키워드를 비롯해 뉴스 속 모자이크 처리된 집과 소속사 페포니뮤직으로 추정되는 로고 모자이크 사진 등을 근거로 최씨의 아들이 잔나비 (이름)이 아니냐는 의혹을 제기했다. 이하 잔나비 공식 sns 글 전문.안녕하세요 페포니뮤직입니다.어제 한 방송사의 뉴스로 인해 피해를 입고 있습니다. 뉴스로 보도된 해당 내용은 일절 사실이 아니며 저희 페포니뮤직과는 전혀 관련이 없습니다. 보도에 거론된 두 아들 또한 아버지의 사업과는 전혀 관련이 없으며 관련 조사를 받은 적도 없습니다. 현재 확인되지 않은 허위사실들이 무분별하게 커뮤니티 게시판 등에 유포되고 있어 이에 있어 법적 강력조치를 취할 예정입니다. 앞으로 근거 없는 허위사실 유포를 자제해주시길 부탁드리겠습니다.<저작권자 © 뉴스1코리아, 무단전재 및 재배포 금지>",2019-05-25 10:08:51,https://www.news1.kr/articles/?3630096,뉴스1,문화
88,"iot 스타트업 웨이웨어러블, 아모레퍼시픽으로부터 투자 유치","iot(사물인터넷) 스킨케어 솔루션 '웨이'(way)를 개발한 국내 스타트업 웨이웨어러블(waywearable)은 1일 아모레퍼시픽으로부터 투자를 유치했다고 밝혔다. 그러나 투자액은 공개하지 않았다.. . 이번 투자로 웨이웨어러블은 웨이의 안정적인 제품 양산과 서비스 개발에 집중하여 올해 말 예정된 글로벌 시장 론칭 준비에 박차를 가할 계획이다.. . 웨이웨어러블이 개발한 웨이는 매일 피부 상태, 날씨 등 환경에 따라 어떤 스킨케어 제품을 얼마나 사용하는 것이 좋은지 등을 실시간으로 알려주는 맞춤형 피부 관리 iot 제품이다. 화장품 가방에 들어갈 정도로 크기가 작고 가벼우며 모바일 앱을 통해 실시간 정보를 얻을 수 있다.. . 지난 올해 5월 미국 크라우드 펀딩 사이트 '인디고고'에서 50일동안 총 12만1588달러(약 1억4358만원) 규모의 선주문을 확보하며 해외 소비자들로부터 호응을 얻었다. 뿐만 아니라 국내 스타트업으로는 이례적으로 해외 패션 웹진 리파이너리29(refinery29) 등 해외 유력 매체를 통해 소개되기도 했다.. . 문종수 웨이웨어러블의 대표는 '글로벌 k-뷰티의 리더 아모레퍼시픽이 기술 기반의 뷰티 시장을 개척하고자 하는 신생 스타트업의 도전을 지지해주었다는 것에 큰 의미가 있다고 생각한다'며 '이에 힘입어 더욱 완성도 있는 제품을 전 세계에 런칭하여 글로벌 스킨케어 시장에 혁신과 긍정적 변화를 가져오겠다'고 포부를 밝혔다.. . (이름) 아모레퍼시픽그룹 전략부문장은 '아모레퍼시픽은 디지털 역량 강화를 통해 고객과 시장에 더 빠르게 대응하기 위한 여러 노력을 이어오고 있다'며 '이번 투자가 글로벌 뷰티 시장의 혁신으로 이어질 수 있기를 기대한다'고 밝혔다..",2015-10-01 11:41:46,https://news.mt.co.kr/mtview.php?no=2015100111095191803,머니투데이뉴스,IT_과학
