,title,content,write_date,url,writer,category
56,'늙어도 즐기고 싶다'… 여유 있는 '액티브 시니어' 뜬다,"한국은 만 65세 (이름) 전체 인구의 약 15%에 달하는 고령사회다. 의학의 발달로 인해 1960년대에 52세에 불과했던 한국인의 평균수명은 50여년 만에 80세를 넘어섰다.. . 최근 통계청이 발표한 ‘대표자 연령별 기업 수’ 자료에 따르면 ‘대표가 40대 미만인 활동 기업 수’는 2011년 91만개에서 2016년 87만개로 감소한 반면, ‘40대 이상을 대표로 둔 기업 수’는 2011년 434만개에서 2016년 489만개로 증가돼 비중에 있어서도 확연한 차이를 보인다. 특히 같은 기간 ‘대표가 60대 (이름) 기업 수’는 93만개에서 126만개로 늘어 시니어층의 사회활동이 늘고 있음을 알 수 있다.. . 이처럼 100세 시대를 맞이하면서 시니어층의 소비 역시 주목받고 있다. 특히 6 25 전쟁 직후 비교정 (이름)에 태어난 베이비부머 세대들의 경우 총인구의 약 15%를 차지하며 사회를 견인하고 있다. ‘액티브 시니어’로 불리는 이들은 기존 노년층에 대한 인식과 달리 퇴직 후 취미, 사회활동 등 활기찬 활동을 이어나가며 스스로에게 투자를 아끼지 않고 있다.. . 한국방송광고진흥공사가 조사한 ‘2015년 트렌드 및 소비자 분석 자료’에 따르면 액티브 시니어층은 다른 연령층보다 두 배가랑 많은 인원이 해외여행을 즐기고 있으며, 67%가 외모를 꾸미기 위해 돈을 지출하는 것이 당연하다고 생각하고 있다. 또한 한국리서치가 50~60대 3299명을 대상으로 한 설문조사에서 59.5%가 ‘젊어 보이는 것이 중요하다’는 답을 했다.. . 이러한 시니어층의 인식은 실제 소비로 이어지고 있다. g마켓에 따르면 2018년 한 해 동안 50~60대 소비자에게 가장 인기 있었던 상품은 마스크팩이었으며, 2017년 대비 구매율이 높아진 상품은 밸리 재즈 살사 댄스복과 건강 검진 기기였다.. . 시니어 시장 확대와 외모에 대한 관심을 반영하듯 중장년 소비자의 유입이 매년 증가하고 있는 분야가 성형시장이다. 시니어들의 제2의 사회 활동이 활발해짐에 따라 건강과 사회적 활동을 위한 자신감을 위해 성형외과를 찾고 있는 것이다. 시니어층의 성형상담 역시 매년 증가하고 있다.. . 특히 중장년층이 가장 많이 찾는 성형수술은 동안 수술로도 불리는 상안검 수술이다. 40대를 넘어서면 눈 주위 피부나 눈꺼풀이 처지고 늘어지는 노화현상이 나타나기 마련이다. 이는 미용적으로 신경 쓰일 뿐 아니라 기능적으로도 큰 불편을 준다. 처진 눈꺼풀이 시야를 가릴 뿐 아니라 억지로 눈을 크게 뜨다 보니 이마 주름도 잡히고 눈끝이 짓무르기도 한다.. . 이때 눈꺼풀 근육을 당겨 눈매를 교정하는 것이 상안검 수술이다. 최근에는 늘어진 피부를 잘라내고 근육을 당기는 절개 방식이 아닌, 절개 없이 실의 장력과 조직의 유착을 활용하는 비절개 상안검 방식이 주목받고 있다. 미용적으로 눈매가 또렷해질 뿐 아니라 눈썹을 쓰지 않고도 자연스럽게 눈을 뜰 수 있도록 해줘 이마주름까지 예방할 수 있다.. . (이름) 바노바기 성형외과 대표원장은 “아름다워 보이고 싶고 젊어 보이고 싶은 마음은 남녀노소 다르지 않다”며 “노화 현상은 단지 나이가 들어가면서 겪는 자연스러운 과정”이라며 “상안검 수술의 경우 많은 분이 단순히 쌍꺼풀 수술로 인식하고 간단하게 생각할 수도 있는데, 기능적인 면까지 고려해야 하는 수술이라 임상 경험이 많은 전문의와 상담하는 것이 바람직하다”고 조언했다.",2019-11-21 09:26:43,https://moneys.mt.co.kr/news/mwView.php?no=2019112109128070533,머니S,산업
57,풀무원 미래형 레스토랑 사업 시작...외식매장 2곳에 로봇 도입,"【서울=뉴시스】(이름) 기자 = 최근 외식업계에 푸드테크(food-tech) 바람이 불고 있는 가운데 풀무원도 서빙로봇을 도입, 미래형 레스토랑 사업에 박차를 가한다. 풀무원이 운영하는 풀무원푸드앤컬처는 전문외식브랜드 ‘찬장’과 ‘메이하오&자연은 맛있다’ 매장에 자율주행 서빙로봇 ‘딜리’를 도입한다고 4일 밝혔다. 딜리는 찬장 판교 라스트리스점과 메이하오&자연은 맛있다 인천공항점 2곳에서 시범운영된다. 딜리는 4개의 적재 트레이를 갖춰 한 번에 4개 테이블에 서빙할 수 있도록 설계됐다. 최대 50㎏까지 적재가 가능하다. 두가지 센서가 장착돼 있어 장애물을 피할 수 있고 정확한 위치로 (이름) 가능하다. 장애물이 나타나면 로봇 전방 40㎝에서 인식하고 멈춘다. 찬장 판교라스트리트점에서는 고객 테이블에 부착된 qr코드를 통해 주문과 결제를 하면 ‘서빙로봇 딜리’가 음식을 서빙해주는 스마트오더 시스템을 도입했다. 풀무원푸드앤컬처는 푸드테크 유니콘 기업인 우아한형제들과 협업, 오프라인 푸드서비스 운영 노하우를 결합해 이번 시스템을 도입하게 됐다. 이번 협업으로 찬장 메뉴는 우아한형제들의 음식배달 서비스 배달의 민족으로 주문할 수 있다. 김경순 풀무원푸드앤컬처 경영지원실장은 '서빙로봇 딜리 도입으로 매장 직원들의 단순 업무는 줄이고 섬세한 고객응대가 가능해졌다“면서 ”서빙로봇은 단순 업무나 무거운 음식, 음료 등을 운반하는 업무를 맡게 되고, 매장 직원은 고객서비스에 더 신경 쓰게 되어 업무 효율성을 극대화할 수 있다'고 소개했다. 이어 “앞으로 미래형 레스토랑 구축을 위해 플랫폼 비즈니스 기업과의 협력을 통한 다양한 고객서비스 경험을 펼칠 계획”이라고 밝혔다.풀무원푸드앤컬처는 ‘서빙로봇 딜리’ 도입에 맞춰 sns와 오프라인 이벤트를 진행한다. 인스타그램에 ‘서빙로봇 딜리’ 서비스에 대한 후기를 올린 고객 10명을 추첨해 11월말 풀무원 ‘포기하지 마라탕면’ 한박스를 증정한다. 또 매장에서 룰겟게임을 하면 서빙로봇의 풀무원바른먹거리송 노래서비스, 서빙로봇과 사진촬영, 사이드 메뉴 무료 제공 등을 받을 수 있다.풀무원푸드앤컬처는 1991년 위탁급식 사업을 시작으로 컨세션 사업, 휴게소 사업, 전문 레스토랑 브랜드 사업 등을 하고 있다. 레스토랑 브랜드로는 ‘자연은 맛있다’ ‘찬장’ ‘내츄럴소울키친’ ‘플레이보6’ ‘명가의 뜰’ 등이 있다.mypark@(이메일)",2019-11-04 09:38:33,https://newsis.com/view/?id=NISX20191104_0000818360,뉴시스,여행레저
58,[7일 날씨] 대설답지 않은 눈…서울·수도권·중부 1㎝ 예상,"(서울=뉴스1) (이름) 기자 = 일년 중 눈이 가장 많이 내린다는 절기인 '대설(大雪)'이자 토요일인 7일 중부지역에는 새벽부터 오후까지 눈 또는 비가 내릴 전망이다. 기상청은 이날(7일) 중국 상하이 부근에 위치한 고기압의 가장자리에 들고, 중부지방은 낮까지 발해만 부근에서 남동진하는 기압골의 영향을 받아 전국이 가끔 구름이 많지만 중부지방은 낮까지 대체로 흐리다고 6일 예보했다. 또 발해만에서 남동진하는 기압골에 동반된 구름대가 서해상에서 발달해 들어오면서 오전 3시 경기 북부와 강원 영서북부에서 눈이 시작돼, 오전 6시에는 서울, 경기 남부와 강원 영서남부, 충청 북부로 확대될 것으로 보인다. 이 눈은 오후 3시 대부분 그치고, 낮 동안 기온이 오르면서 눈과 비가 섞여 내리는 곳도 있다. 기상청에 따르면 서울, 경기, 강원 영서, 충청 북부, 서해 5도의 예상적설량은 1㎝ 내외, 예상강수량은 5㎜ 미만이다. 아침 최저기온은 9~0도(평년 6~3도), 낮 최고기온은 3~10도(평년 5~12도)로 평년보다 2~3도가량 낮겠다. 기상청 관계자는 '아침기온이 6일보다 5~7도 가량 높지만, 중부 내륙을 중심으로 영하 10도 내외의 기온분포를 보이는 곳이 있다. 또 아침에는 바람이 약해 체감온도는 실제기온과 비슷하다'고 밝혔다. 지역별 아침 최저기온은 서울 -3도 인천 0도 춘천 -8도 강릉 -1도 대전 -4도 대구 -3도 부산 -1도 전주 -4도 광주 -3도 제주 6도, 낮 최고기온은 서울 6도 인천 6도 춘천 4도 강릉 9도 대전 6도 대구 8도 부산 10도 전주 7도 광주 8도 제주 10도로 예상된다.바다의 물결은 남해 앞바다에서 0.5~1.0m, 서해와 동해 앞바다에서 0.5~1.5m, 서해와 남해 먼바다에서 최고 2.0m, 동해 먼바다에서 최고 4.0m로 높게 일겠다.국립환경과학원은 전 권역의 미세먼지 예보등급이 '보통'으로 예상되지만 수도권, 충청권은 밤에 '나쁨' 수준일 것이라고 예상했다. 국립환경과학원은 '중서부지역은 늦은 오후에 국외 미세먼지가 유입되고 대기 정체가 이어져 국내 외 미세먼지가 축적되면서 밤에 농도가 높을 것으로 예상된다'고 설명했다. 기상청 관계자는 '새벽부터 낮 사이에 눈이 내리는 지역에서는 눈이 조금 쌓이는 곳이 있고, 내린 눈이나 비가 얼어 도로가 미끄러운 곳이 있으니, 교통안전에 각별히 유의하기 바란다'고 당부했다. 또한 '건조특보가 발효 중인 서울, 경기 북부와 강원, 경상 일부와 충북 남부는 대기가 매우 건조하겠다. 그 밖의 지역도 차차 건(이름)니, 산불 등 각종 화재예방에 각별히 유의할 필요가 있다'고 덧붙였다. 다음은 7일 지역별 날씨 예보.-서울 경기: -9~6도, 최고강수확률 60%-서해5도: 3~7도, 최고강수확률 60% -(이름)서: -9~4도, 최고강수확률 70%-(이름)동: -8~8도, 최고강수확률 20%-충청북도: -9~5도, 최고강수확률 60%-충청남도: -7~7도, 최고강수확률 30% -경상북도: -10~9도, 최고강수확률 20% -경상남도: -9~10도, 최고강수확률 20% -울릉 독도: 3~9도, 최고강수확률 20%-전라북도: -9~7도, 최고강수확률 30%-전라남도: -4~9도, 최고강수확률 20%-제주도: 6~11도, 최고강수확률 20%<저작권자 © 뉴스1코리아, 무단전재 및 재배포 금지>",2019-12-06 17:45:47,https://www.news1.kr/articles/?3787428,뉴스1,사건사고
59,"與, '소속 의원 26명 불참' 본회의 추경 의결지연 사과","= (이름) 더불어민주당 대표와 (이름) 원내대표 등 여당 지도부가 24일 소속 의원들의 불참으로 지난 22일 본회의에서 일자리 추경 표결이 늦어진 것에 대해 사과했다. (이름) 대표는 이날 국회에서 열린 당 최고위원회의에서 '우리 당의 느슨한 행태는 정당화될 수 없을 것'이라며 '국민께 심려 끼친 점을 당 대표로서 정중히 사과드린다'고 했다. 그는 '의회 운영의 가장 기본적인 정족수 관리를 못해 당원으로부터 많은 질타를 받았다'며 '집권 이후 우리 스스로 먼저 돌아봐야 할 것'이라고 했다.국회는 지난 22일 추경안 의결을 위해 본회의를 열었지만 정족수 미달로 개의 후 3시쯤 지난 후에야 가까스로 표결을 마쳤다. 우 원내대표도 '추경 과정에서 본회의 표결이 지연되는 것을 보여드린 것에 대해 여당 원내대표로서 책임감을 무겁게 느끼고 국민께 사과드린다'고 했다. 이어 '국회의장과 함께 회의에서 한 약속을 어긴 한국당을 탓하지도 않겠다'며 '원내 수장으로서 예측하지 못한 제게 책임이 있다'고 했다. 우 원내대표는 '앞으로 회기 중 국외 출장 금지 등 제도적 보완책을 마련하겠다'고 했다.당시 본회의에는 불참한 민주당 의원 총 120명 중 26명이 불참했다. 추경은 국회 현 재적의원(299명) 절반 (이름) 참석에 절반 (이름) 찬성해야 의결이 가능하지만 지난 22일 정족수를 채우지 못해 한참동안 지연끝에 찬성 140명, 반대 31명, 기권 8명으로 통과됐다.<저작권자 © 뉴스1코리아, 무단전재 및 재배포 금지>",2017-07-24 09:40:02,https://www.news1.kr/articles/?3056047,뉴스1,정치
60,아베가 피하고 싶은 '도쿄 올림픽' 시나리오 3가지,". 2020 도쿄올림픽을 앞둔 일본의 시름이 깊다. 개최가 세 달 밖에 남지 않은 시점에서 코로나19가 전 세계적으로 확산하고 있어서다. 일본은 예정대로 올림픽을 개최하겠다는 입장을 고수하고 있지만, 예선조차 제대로 치러지지 않는 상황에서 개최가 가능할지에 대한 의문이 크다. . . ━. 올림픽 강행 의지 드러낸 아베…일본 국민은 '연기 해야'. ━. 일본 아베 신조 총리는 최근 코로나19 확산을 극복하고 올림픽을 무사히 예정대로 개최하고 싶다는 뜻을 밝혔다.. . 아베 총리는 지난 14일(이하 한국시간) 기자회견에서 '우리는 앞으로 국제올림픽위원회(ioc)와 협력해 코로나19 확산을 막고 올림픽을 예정대로 무사히 개최하겠다'고 말했다. . . 하지만 일본 국민들 의견은 아베 총리와는 반대로 흐르고 있다. 일본 스포츠 전문 매체 스포츠호치가 지난 14일 인터넷 홈페이지를 통해 실시한 설문조사 결과에 따르면 응답자 500명 중 62%가 '개최를 연기해야 한다'고 답했다. 아예 취소해야한다는 응답자도 19%나 됐다. 지난 15일 스포츠닛폰의 여론조사에서도 정상 개최에 반대하는 의견이 77.8%로 나타났다. . . 도쿄올림픽 개최 연기는 국제사회에서도 제기됐다. 트럼프 대통령은 지난 13일 백악관 집무실에서 기자들과 만나 '개인적인 생각이지만 빈 경기장에서 올림픽을 치르는 것보다 1년 연기하는 것이 나을 수 있다'고 언급했다.. . 현재 일본 안팎의 분위기와 정서상 오는 7월 정상적인 올림픽 개최는 요원해지는 모양새다. 배드민턴, 야구, 조정 등 올림픽 출전권이 걸린 경기의 예선전도 코로나19 여파로 중단된 상태다. . . 이러한 상황에서 일본이 예정대로 올림픽을 개막하지 않을 경우, 남은 선택지는 크게 ①연기 ②취소 ③무관중 경기 세 가지다. 이중 올림픽 연기나 취소를 위해선 개최 60일 전인 오는 5월 말까지 결론을 내려야 한다. . . ━. 대안 1. 개최 연기. . ━. . 지금으로선 도쿄올림픽을 1~2년 늦추는 게 현실적인 방(이름)는 분석이 나온다. 다카하시 하루유키 도쿄올림픽 조직위원회 집행위원은 '코로나19 때문에 올여름 도쿄올림픽을 치르지 못한다면 행사를 1~2년 늦추는 게 가장 현실적인 선택'이라는 의견을 내놨다. . . 현실적인 방(이름)만 간단한 것은 아니다. 1년을 연기할 경우 세계수영선수권대회, 세계육상선수권대회와 시기가 겹친다. 수영은 2021년 7월16일 후쿠오카시에서, 육상은 2021년 8월6일 미국 (이름)주에서 열린다. 이 대회들은 중계권료가 중요한 수입원 중 하나다. 이 때문에 올림픽 연기를 (이름) 일정을 (이름)기는 어려울 것으로 보인다. . . 올림픽을 2년 연기하는 것이 가장 쉬운 방안이 될 수 있지만 이마저도 녹록지 않다. 카타르월드컵이 2022년 11~12월에 열려 일단 시기는 겹치지 않는다. 그렇지만 일부 선수들이 출전권을 다시 획득해야 하는 등의 불이익을 받을 수 있다는 우려가 존재한다. 개최 연기 후 경기장 유지·보수 등 다시 올림픽을 준비하는 데 드는 추가 비용 역시 부담이다. . . 이에 대해 산케이신문은 '1~2년을 연기할 경우, 경기장 확보가 어려워지며 대회 경비도 늘어날 것이 확실하다'며 '대표선수 선발을 다시 진행해야 하는 어려움도 무시할 수 없다'고 짚었다.. . ━. 대안 2. 올림픽 취소. ━. . 도쿄올림픽 정상 개최가 불투명해지면서 아예 올림픽을 취소해야 한다는 목소리도 커지고 있다. . . 만약 도쿄올림픽이 취소될 경우 질병에 의한 역대 최초 취소 사례로 남게 된다. 2002년 솔트레이크시티 동계올림픽 땐 사스, 2010년 밴쿠버 동계올림픽 때는 신종플루, 2016년 리우데자네이루 올림픽 당시에는 지카 바이러스가 유행했지만 대회는 그대로 진행됐다. . . 그러나 올림픽을 취소해 발생하는 비용적 손해를 고려하면 현실적으로 불가능하다는 해석이 주를 이룬다. 산케이신문은 'ioc 입장에서는 막대한 손실을 보게 되는 대회 취소 결정이 간단하지 않다'고 분석했다. . . ioc는 4년마다 열리는 올림픽 중계권을 판매하며 약 57억 달러(약 6조9882억원)의 수익을 거두는데 이 중 73%가 전 세계 방송사에서 거둬들이는 중계권이다. 미국 nbc유니버설은 도쿄 올림픽 중계권으로 11억 달러(약 1조34973497억원)를 지불한 상태다.. . ioc뿐만이 아니라 일본의 경제적 타격도 막대하다. smbc 닛코증권은 도쿄올림픽이 취소될 경우 10억 달러(1조2270억원)에 달하는 입장료 수입을 포함해 총 750억 달러(91조9500억원)의 경제피해를 일본이 입게 될 것으로 전망하고 있다.. . ━. 대안 3. 무관중 경기. ━. 도쿄올림픽을 무관중으로 개최할 가능성도 제기된다. . . 하라다 무네히코 와세다대 교수는 교도통신과의 인터뷰에서 '이미 올림픽 관련 준비에 3조엔(약 34조6000억원)이 투입된 만큼 취소보다 무관중 경기가 나은 선택이 될 수 있다'고 말했다. . . 무관중 개최할 경우 일본과 ioc는 티켓 수입을 잃게 된다. 일본은 도쿄올림픽 경기 관람 티켓 780만개 중 절반 이상을 국내 관중에게 이미 판매한 상태로 알려졌다. . . 무관중 경기라고 해도 위험 요소는 존재한다. 코로나19가 관중 사이에서 확산하는 건 막을 수 있지만, 선수 간 감염까지는 완전히 차단하지 못하기 때문이다. . . 이미 도쿄올림픽의 첫 공식행사는 '무관중'으로 진행됐다. 지난 12일 그리스에서 열린 성화 채화식 행사는 대중에 공개되지 않고 극히 제한된 인원만 참석한 채 진행됐다. 채화식 행사가 무관중으로 열리기는 사회주의권 국가들이 비토해 '반쪽 올림픽'으로 거행됐던 1984년 미국 la올림픽 이후 36년 만에 처음이다.. . 도쿄올림픽조직위는 오는 20일 미야기현에서 열리는 성화 도착식, 성화 봉송 출발 행사를 모두 무관중으로 치르기로 결정했다. 또 전국을 도는 성화 봉송 릴레이 행사에도 최소한의 인원만 참가할 것을 권유했다.. . ━. ioc, 17일 국제경기연맹과 긴급 화상회의 진행. ━. . 이런 가운데 ioc는 각 종목 국제경기연맹과 코로나19 사태를 논의하는 긴급 회의를 열기로 했다. . . afp통신 등은 지난 16일 '토마스 바흐 ioc 위원장과 하계올림픽 정식 종목의 국제경기연맹 회장들이 17일(현지시각) 화상 회의를 진행한다'고 보도했다.. . 소식통에 따르면 ioc는 코로나19 확산으로 각 종목의 도쿄올림픽 예선이 연기되거나 취소되고 있는 것과 관련해 의견을 나눌 예정이다. 이 자리에서 도쿄올림픽 개최 여부가 논의되는 것 아니냐는 전망도 나온다. . . ioc 관계자는 '국제경기연맹과 국가올림픽위원회(noc), 선수들에게 현재 상황에 대한 정보를 전달하기 위한 회의'라며 '코로나19 위기 상황 대응과 관련해 국제경기연맹의 질문을 받고 답하는 자리가 될 것'이라고 설명했다..",2020-03-17 04:35:00,https://news.mt.co.kr/mtview.php?no=2020031613351874354,머니투데이뉴스,국제
61,"한·케냐, 보건의료·의약품 유통 분야 협력","【세종=뉴시스】(이름) 기자 = 보건복지부는 31일 케냐 보건부와 보건의료와 의약품 유통·관리 분야에서 총 3건의 양해각서를 체결했다고 밝혔다. . . 보건의료 분야는 ▲의료인력 초청 연수 및 현지 훈련 ▲만성질환 관리 외에도 한국의 it 기반 보건의료 노하우를 활용한 공공보건정보체계 구축▲ 원격의료 및 병원정보시스템 등 분야의 협력이다.. . 복지부는 케냐 보건부가 원격의료와 병원 (이름)에 관심이 많아 양국 간 협력을 통해 우리나라 의료 it기기, 병원정보시스템의 수출 가능성을 높일 것으로 기대하고 있다.. . 한국국제보건의료재단, 건강보험심사평가원도 케냐 의약품 공급청(kemsa)과 양해각서를 체결하고 한국의 의약품 정보관리체계 개발경험과 전문가 자문을 제공하기로 했다.. . 우리측은 또 케냐 국가병원보험기금과 국민건강보험 분야 협력 4자 양해각서를 맺고 it 기반의 건강보험 관리 체계 강화, 관련 인력 역량 구축 등의 분야에서도 협력 사업을 추진키로 했다.. . 보건복지부 관계자는 '보건의료와 it의 접목은 보건의료 산업의 경쟁력을 강화하고, 국민들의 보건의료 서비스 접근성을 획기적으로 개선시킬 것'이라며 '추후에도 케냐에 적용 가능한 it 기반 보건의료서비스를 지속 발굴해 나가겠다'고 말했다.. . ijoinon@(이메일). copyright ⓒ (이메일), 무단 전재 및 재배포 금지",2016-05-31 20:03:59,https://newsis.com/view/?id=NISX20160531_0014120211,뉴시스,건강
62,美 1월 소비자물가 전월比 0.7% 하락,미국 소비자물가 하락세가 시장 전망을 소폭 넘어선 것으로 확인됐다. 다만 근원 소비자물가는 전망보다 앞선 상승률을 기록했다.. . 26일(현지시간) 미국 노동부는 1월 미국 소비자물가지수(cpi)가 전월대비 0.7% 하락했다고 발표했다. 앞서 시장이 내놓은 전망치 0.6% 하락보다 부진한 결과다. 전년 동월대비 1월 cpi는 0.1% 하락해 시장 전망에 부합했다. . . 반면 변동성이 큰 식품 및 에너지 제외 근원 cpi는 전월대비 0.2% 상승해 전망치 0.1% 상승을 앞질렀다. 12월 근원 cpi는 기존 보합에서 0.1% 상승으로 상향조정됐다. . .,2015-02-26 22:52:37,https://news.mt.co.kr/mtview.php?no=2015022622510547095,머니투데이뉴스,국제
